{"architecture":{"component_kinds":[{"id":"prism.arch@1.0.0::ComponentKind.cliAdapter","index":0},{"id":"prism.arch@1.0.0::ComponentKind.database","index":1},{"id":"prism.arch@1.0.0::ComponentKind.externalSystem","index":2},{"id":"prism.arch@1.0.0::ComponentKind.releaseBinary","index":3},{"id":"prism.arch@1.0.0::ComponentKind.service","index":4},{"id":"prism.arch@1.0.0::ComponentKind.staticSite","index":5}],"components":[{"id":"Foundation.Arch::componentAuth","index":0,"kind_id":"prism.arch@1.0.0::ComponentKind.database","name":"auth","text":"Holds credentials and answers lookups from the gateway."},{"id":"Foundation.Arch::componentGateway","index":1,"kind_id":"prism.arch@1.0.0::ComponentKind.service","name":"gateway","text":"Accepts external requests and forwards them to the authentication store."}],"concerns":[{"id":"Foundation.Arch::concernSecurity","index":0,"name":"security","text":"Credentials and requests must not be disclosed or altered in transit or at rest."}],"edge_kinds":[{"id":"prism.arch@1.0.0::EdgeKind.controlFlow","index":0},{"id":"prism.arch@1.0.0::EdgeKind.dataFlow","index":1}],"edges":[{"from_index":0,"id":"Foundation.Arch::edgeIngress","index":0,"kind_id":"prism.arch@1.0.0::EdgeKind.dataFlow","to_index":1},{"from_index":1,"id":"Foundation.Arch::edgeReturnCycle","index":1,"kind_id":"prism.arch@1.0.0::EdgeKind.controlFlow","to_index":0}],"model_kinds":[{"id":"prism.arch@1.0.0::ModelKind.componentModel","index":0},{"id":"prism.arch@1.0.0::ModelKind.qualityModel","index":1},{"id":"prism.arch@1.0.0::ModelKind.securityModel","index":2}],"stakeholders":[{"id":"Foundation.Arch::stakeholderOperator","index":0,"name":"operator","text":"Runs the system in production and answers for its availability."}],"viewpoints":[{"concern_index":0,"id":"Foundation.Arch::viewpointOperations","index":0,"model_kind_index":0,"stakeholder_index":0}],"views":[{"id":"Foundation.Arch::viewPrimary","index":0,"model_kind_index":0,"viewpoint_index":0}]},"provenance":{"compiler_semantics_id":"5262e5b4c8b5668ae7066ad686757a6bb7f80c941d515fb9d586894fbc7de69a","emitter_semantics_id":"38dd22e53a4739ba18a43abda7e88d9547b206db383e6b92384d539fdcbabe7d","facet_packages":[{"content_id":"f1fd925a1f9e04ec06411839c077eefa7bad02a35beae35004ce971c6d078011","package":"prism.arch","version":"1.0.0"},{"content_id":"88748e3b24fa79693aed461bbce0fa626ec83356cd7ef980adaa22722a907602","package":"prism.qual","version":"1.0.0"},{"content_id":"55bd2bc254d4170f6e76adc558955f1d1a31aa8a22ac88a3e3d6fe9307f76466","package":"prism.sec","version":"1.0.0"}],"semantic_id":"275e2b9b289d6e2d2999ef9b99f924a5b15ace5460bb829e1a6d3d32e2a5f050","snapshot_id":"d036b69d546338502891774c9707dcc0a1d412e014d406c544f23b786b5feeb2","source_id":"3f4398e51cefb9fcffd8ee4452919d8d8a2f8310092a3556b76eb12d8033ae50"},"quality":{"characteristics":[{"id":"Foundation.Qual::characteristicInteractionCapability","index":0},{"id":"Foundation.Qual::characteristicMaintainability","index":1}],"measures":[{"id":"Foundation.Qual::measureDependencyCount","index":0,"requirement_index":0,"threshold":10}],"requirements":[{"id":"Foundation.Qual::requirementModuleBoundaries","index":0,"subcharacteristic_index":1},{"id":"Foundation.Qual::requirementWcag1411ForcedColorsNonTextContrast","index":1,"subcharacteristic_index":0},{"id":"Foundation.Qual::requirementWcag413StatusMessages","index":2,"subcharacteristic_index":0}],"subcharacteristics":[{"characteristic_index":0,"id":"Foundation.Qual::subcharacteristicInclusivity","index":0},{"characteristic_index":1,"id":"Foundation.Qual::subcharacteristicModularity","index":1}]},"schema":"prismpm/model-document/1","security":{"activities":[{"control_index":0,"id":"Foundation.Sec::activityRotateCredentials","index":0}],"assets":[{"component_index":1,"id":"Foundation.Sec::assetCredentials","index":0}],"controls":[{"id":"Foundation.Sec::controlMutualTls","index":0,"risk_index":0}],"impacts":[{"id":"prism.sec@1.0.0::Impact.critical","index":0},{"id":"prism.sec@1.0.0::Impact.major","index":1},{"id":"prism.sec@1.0.0::Impact.minor","index":2}],"likelihoods":[{"id":"prism.sec@1.0.0::Likelihood.high","index":0},{"id":"prism.sec@1.0.0::Likelihood.low","index":1},{"id":"prism.sec@1.0.0::Likelihood.medium","index":2}],"measurements":[{"control_index":0,"id":"Foundation.Sec::measurementMutualTls","index":0,"passed":true}],"risks":[{"asset_index":0,"id":"Foundation.Sec::riskUnauthorizedAccess","impact_id":"prism.sec@1.0.0::Impact.critical","index":0,"likelihood_id":"prism.sec@1.0.0::Likelihood.high","threat_index":0}],"threats":[{"id":"Foundation.Sec::threatUnauthorizedAccess","index":0}]},"standards_profile":["ISO-25010-2023","ISO-27005-2022","ISO-27034-1-2011","ISO-27034-5-2017","ISO-42010-2022"]}